{
  "schemaVersion": 1,
  "recordType": "mapping",
  "id": "mapping.control.work_orders.condition.suggested_row",
  "nativeId": "control.work_orders.condition.suggested_row",
  "applicability": { "buildIds": ["build.df.0.53.15-win64-steam-683c721d"] },
  "implementations": [
    {
      "kind": "client",
      "file": "web/js/dwf-labor-work-orders.js",
      "symbol": "woSuggestionRowsHtml",
      "dfcuiComponent": "DFCUI.rowHtml",
      "assets": ["WORK_ORDERS_ADD_SUGGESTED_CONDITION"],
      "tests": ["tools/harness/b285_workorder_condition_editor_test.mjs"]
    },
    {
      "kind": "server",
      "file": "dwf.lua",
      "symbol": "suggested_conditions",
      "wireField": "suggestions[]",
      "assets": [],
      "tests": ["tools/harness/b285_workorder_conditions_read_test.mjs", "tools/harness/b285_workorder_condition_editor_test.mjs"]
    },
    {
      "kind": "route",
      "file": "src/work_orders.cpp",
      "symbol": "register_work_order_routes",
      "route": "GET /order-suggested-conditions",
      "assets": [],
      "tests": ["tools/harness/b285_workorder_condition_editor_test.mjs"]
    }
  ],
  "disposition": "partial",
  "audit": {
    "classification": "local-repair",
    "findings": ["The browser can render exact server rows and preserve matching rows, but the hardcoded barrel provider was removed. The server now fails closed with an empty deferred list until DF's transient native full filters can be captured losslessly." ]
  },
  "decisionRefs": [],
  "knownDeviations": [],
  "lastVerified": {
    "buildId": "build.df.0.53.15-win64-steam-683c721d",
    "codeVersion": "b4cf3f66a1adda05e7eba4e10450b9dd41b8c770"
  }
}
